{
	"schemaVersion": "equipment-image-assignment-v2",
	"assignmentId": "assignment-material-equipment-v2-living-branch-staff-v2",
	"targetId": "material-equipment-v2-living-branch-staff-v2",
	"contractVersion": "equipment-image-production-contract-v2",
	"rendererVersion": "equipment-image-prompt-v2",
	"assignedAt": "2026-09-02T20:30:00.000Z",
	"runActivationRequired": true,
	"dryRun": false,
	"retryCeiling": 0,
	"permittedOutputs": {
		"candidatePath": "assets/equipment/experiments/material-equipment-v2/candidates/a/living-branch/staff-v2.png",
		"provenanceResultPath": "assets/equipment/experiments/material-equipment-v2/results/a/living-branch/staff-v2.json"
	},
	"forbiddenSharedPaths": [
		"assets/equipment/experiments/material-equipment-v1",
		"assets/equipment/experiments/material-equipment-v2/manifest.json",
		"assets/equipment/experiments/material-equipment-v2/allocation-plan.json",
		"assets/equipment/experiments/material-equipment-v2/visual-profile",
		"assets/equipment/experiments/material-equipment-v2/targets",
		"assets/equipment/experiments/material-equipment-v2/assignments",
		"assets/equipment/experiments/material-equipment-v2/reviews",
		"assets/equipment/experiments/material-equipment-v2/runs",
		"assets/enemies",
		"packages/contracts/src/image-production.ts",
		"tools/persist-image-production-output.ts",
		"skills/summonlab-image-production"
	],
	"completionContract": {
		"oneTargetOneImage": true,
		"structuredResultRequired": true,
		"sharedFilesMustRemainUntouched": true,
		"selfPromotionForbidden": true
	}
}
